{
  "$schema": "https://json-schema.org/draft/2020-12/schema",
  "$id": "https://llm-provable-computer/spec/stwo-phase37-recursive-artifact-chain-harness-receipt.schema.json",
  "title": "S-two Phase 37 Recursive Artifact Chain Harness Receipt",
  "type": "object",
  "additionalProperties": false,
  "required": [
    "proof_backend",
    "receipt_version",
    "semantic_scope",
    "verifier_harness",
    "proof_backend_version",
    "statement_version",
    "step_relation",
    "required_recursion_posture",
    "recursive_verification_claimed",
    "cryptographic_compression_claimed",
    "phase29_input_contract_verified",
    "phase30_step_envelope_manifest_verified",
    "phase31_decode_boundary_bridge_verified",
    "phase32_statement_contract_verified",
    "phase33_public_inputs_verified",
    "phase34_shared_lookup_verified",
    "phase35_target_manifest_verified",
    "phase36_verifier_harness_receipt_verified",
    "source_binding_verified",
    "phase29_contract_version",
    "phase29_semantic_scope",
    "phase29_input_contract_commitment",
    "phase30_manifest_version",
    "phase30_semantic_scope",
    "phase30_source_chain_commitment",
    "phase30_step_envelopes_commitment",
    "phase31_decode_boundary_bridge_commitment",
    "phase32_recursive_statement_contract_commitment",
    "phase33_recursive_public_inputs_commitment",
    "phase34_shared_lookup_public_inputs_commitment",
    "phase35_recursive_target_manifest_commitment",
    "phase36_recursive_verifier_harness_receipt_commitment",
    "total_steps",
    "chain_start_boundary_commitment",
    "chain_end_boundary_commitment",
    "source_template_commitment",
    "aggregation_template_commitment",
    "input_lookup_rows_commitments_commitment",
    "output_lookup_rows_commitments_commitment",
    "shared_lookup_artifact_commitments_commitment",
    "static_lookup_registry_commitments_commitment",
    "recursive_artifact_chain_harness_receipt_commitment"
  ],
  "properties": {
    "proof_backend": { "const": "stwo" },
    "receipt_version": { "const": "stwo-phase37-recursive-artifact-chain-harness-receipt-v1" },
    "semantic_scope": { "const": "stwo_execution_parameterized_recursive_artifact_chain_harness_receipt" },
    "verifier_harness": { "const": "source-bound-recursive-artifact-chain-verifier-v1" },
    "proof_backend_version": { "const": "stwo-phase12-decoding-family-v9" },
    "statement_version": { "const": "statement-v1" },
    "step_relation": { "const": "decoding_step_v2" },
    "required_recursion_posture": { "const": "pre-recursive-proof-carrying-aggregation" },
    "recursive_verification_claimed": { "const": false },
    "cryptographic_compression_claimed": { "const": false },
    "phase29_input_contract_verified": { "const": true },
    "phase30_step_envelope_manifest_verified": { "const": true },
    "phase31_decode_boundary_bridge_verified": { "const": true },
    "phase32_statement_contract_verified": { "const": true },
    "phase33_public_inputs_verified": { "const": true },
    "phase34_shared_lookup_verified": { "const": true },
    "phase35_target_manifest_verified": { "const": true },
    "phase36_verifier_harness_receipt_verified": { "const": true },
    "source_binding_verified": { "const": true },
    "phase29_contract_version": { "const": "stwo-phase29-recursive-compression-input-contract-v1" },
    "phase29_semantic_scope": { "const": "stwo_phase29_recursive_compression_input_contract" },
    "phase29_input_contract_commitment": { "$ref": "#/$defs/hash32" },
    "phase30_manifest_version": { "const": "stwo-phase30-decoding-step-proof-envelope-manifest-v1" },
    "phase30_semantic_scope": { "const": "stwo_execution_parameterized_decoding_step_proof_envelope_manifest" },
    "phase30_source_chain_commitment": { "$ref": "#/$defs/hash32" },
    "phase30_step_envelopes_commitment": { "$ref": "#/$defs/hash32" },
    "phase31_decode_boundary_bridge_commitment": { "$ref": "#/$defs/hash32" },
    "phase32_recursive_statement_contract_commitment": { "$ref": "#/$defs/hash32" },
    "phase33_recursive_public_inputs_commitment": { "$ref": "#/$defs/hash32" },
    "phase34_shared_lookup_public_inputs_commitment": { "$ref": "#/$defs/hash32" },
    "phase35_recursive_target_manifest_commitment": { "$ref": "#/$defs/hash32" },
    "phase36_recursive_verifier_harness_receipt_commitment": { "$ref": "#/$defs/hash32" },
    "total_steps": { "type": "integer", "minimum": 1 },
    "chain_start_boundary_commitment": { "$ref": "#/$defs/hash32" },
    "chain_end_boundary_commitment": { "$ref": "#/$defs/hash32" },
    "source_template_commitment": { "$ref": "#/$defs/hash32" },
    "aggregation_template_commitment": { "$ref": "#/$defs/hash32" },
    "input_lookup_rows_commitments_commitment": { "$ref": "#/$defs/hash32" },
    "output_lookup_rows_commitments_commitment": { "$ref": "#/$defs/hash32" },
    "shared_lookup_artifact_commitments_commitment": { "$ref": "#/$defs/hash32" },
    "static_lookup_registry_commitments_commitment": { "$ref": "#/$defs/hash32" },
    "recursive_artifact_chain_harness_receipt_commitment": { "$ref": "#/$defs/hash32" }
  },
  "$defs": {
    "hash32": {
      "type": "string",
      "pattern": "^[0-9a-f]{64}$"
    }
  }
}
